{
  "contract_name": "thesis-proposal-v1",
  "schema_version": "1.0.0",
  "producer": {
    "agent_name": "instrument-thesis-drafter",
    "agent_version": "fixture-1",
    "run_id": 90001
  },
  "subject": {
    "symbol": "BHP.AU"
  },
  "created_at": "2026-07-20T06:12:00Z",
  "proposal": {
    "symbol": "BHP.AU",
    "flavour": "individual_equity",
    "thesis_text": "Synthetic thesis: resilient operating economics may support the investment case if the cited conditions persist.",
    "conviction_level": null,
    "themes": [
      "synthetic-resources"
    ],
    "entry_band_lower": {
      "label": "Synthetic lower observation band",
      "value": "38.000000",
      "provenance": "derived",
      "evidence_citation_ids": [
        900001
      ],
      "formula": "synthetic_close_price_aud - synthetic_buffer_aud"
    },
    "entry_band_upper": {
      "label": "Synthetic upper observation band",
      "value": "41.000000",
      "provenance": "derived",
      "evidence_citation_ids": [
        900001
      ],
      "formula": "synthetic_close_price_aud + synthetic_buffer_aud"
    },
    "stop_price": null,
    "target_price": null,
    "timeline_days": 63,
    "invalidation_conditions": [
      {
        "condition": "The cited resilient cost-position claim is withdrawn or materially contradicted.",
        "severity": "critical",
        "evidence_citation_ids": [
          900002
        ]
      }
    ],
    "sections": [
      {
        "kind": "business",
        "body": "This synthetic example represents a diversified resources issuer.",
        "figures": [],
        "evidence_citation_ids": [
          900002
        ]
      },
      {
        "kind": "valuation",
        "body": "The observation band is shown only as a provenance and Decimal contract example.",
        "figures": [
          {
            "label": "Synthetic reference price",
            "value": "40.000000",
            "provenance": "cited",
            "evidence_citation_ids": [
              900001
            ],
            "formula": null
          }
        ],
        "evidence_citation_ids": [
          900001
        ]
      },
      {
        "kind": "evidence_ledger",
        "body": "Every synthetic claim in this fixture links to an explicit evidence snapshot.",
        "figures": [],
        "evidence_citation_ids": [
          900001,
          900002
        ]
      }
    ],
    "evidence_citation_ids": [
      900001,
      900002
    ]
  },
  "canonical_hash": {
    "canonicalization": "RFC8785",
    "hash_algorithm": "SHA-256",
    "excluded_json_pointer": "/canonical_hash/payload_sha256",
    "payload_sha256": "14d79b48415754dc3920bf602a11e3ac71abcc92dae72d7970dd14ffef96d198"
  }
}
